日期,凭证号,摘要,贷方金额,发票号,业务类型
2024-07-31,399.0,确认废料收入/发票号24442000000312918319/佛山盈娇恒,2087269.91,发票号24442000000312918319,废品回收
2024-09-30,402.0,确认废料收入/发票号24442000000456432446/佛山盈娇恒,405602.66,发票号24442000000456432446,废品回收
2024-11-30,407.0,确认废料收入/发票号24442000000559750555/佛山盈娇恒,577999.12,发票号24442000000559750555,废品回收
2024-12-31,489.0,确认废料收入/发票号24442000000656498785/佛山盈娇恒,371558.0,发票号24442000000656498785,废品回收
2025-03-31,273.0,确认废料收入/发票号25442000000180151842/佛山盈娇恒,1238152.21,发票号25442000000180151842,废品回收
2025-04-30,194.0,确认废料收入/发票号25442000000246926891/佛山盈娇恒,222387.61,发票号25442000000246926891,废品回收
